{
  "schema_version": "1.0.0",
  "game_id": "00_01",
  "slug": "robot-repair-clicker",
  "title": "\u30ed\u30dc\u30c3\u30c8\u4fee\u7406\u30af\u30ea\u30c3\u30ab\u30fc",
  "lifecycle": "complete",
  "summary": "\u5236\u9650\u6642\u9593\u5185\u306b\u30ed\u30dc\u30c3\u30c8\u3092\u30af\u30ea\u30c3\u30af\u3057\uff0c\u4fee\u7406\u7387\u3092100%\u306b\u3059\u308b\u30b2\u30fc\u30e0\uff0e",
  "source": {
    "complete_path": "games/robot-repair-clicker",
    "toolchain": "goboscript",
    "configuration": "games/robot-repair-clicker/goboscript.toml",
    "files": [
      "stage.gs",
      "main.gs",
      "message_panel.gs"
    ]
  },
  "target_learners": {
    "grades": ["\u5c0f4", "\u5c0f5", "\u5c0f6"],
    "support": "facilitated",
    "assumed_skills": [
      "\u5909\u6570\u306e\u5024\u3092\u753b\u9762\u8868\u793a\u3068\u5bfe\u5fdc\u4ed8\u3051\u3089\u308c\u308b",
      "\u30e1\u30c3\u30bb\u30fc\u30b8\u9001\u4fe1\u3068\u53d7\u4fe1\u306e\u5bfe\u5fdc\u3092\u8ffd\u8de1\u3067\u304d\u308b",
      "\u5b9f\u884c\u7d50\u679c\u3092\u8a00\u8449\u3067\u8a18\u9332\u3067\u304d\u308b"
    ]
  },
  "learning": {
    "primary_concepts": [
      {
        "id": "state-management",
        "label": "\u72b6\u614b\u7ba1\u7406",
        "description": "\u4fee\u7406\u56de\u6570\uff0c\u4fee\u7406\u7387\uff0c\u898b\u305f\u76ee\u306e3\u3064\u306e\u72b6\u614b\u3092\u5bfe\u5fdc\u4ed8\u3051\u308b\uff0e"
      },
      {
        "id": "feedback-sync",
        "label": "\u8868\u793a\u306e\u540c\u671f",
        "description": "\u5185\u90e8\u72b6\u614b\u306e\u66f4\u65b0\u5f8c\u306b\u8868\u793a\u66f4\u65b0\u30a4\u30d9\u30f3\u30c8\u304c\u5fc5\u8981\u306a\u7406\u7531\u3092\u8abf\u3079\u308b\uff0e"
      }
    ],
    "transfer_family": "click-progress",
    "learning_goals": [
      "\u6570\u5024\u8868\u793a\u3068\u30b3\u30b9\u30c1\u30e5\u30fc\u30e0\u8868\u793a\u306e\u4e0d\u4e00\u81f4\u3092\u518d\u73fe\u3059\u308b\uff0e",
      "\u72b6\u614b\u3092\u66f4\u65b0\u3059\u308b\u51e6\u7406\u3068\u8868\u793a\u306b\u901a\u77e5\u3059\u308b\u51e6\u7406\u3092\u5206\u3051\u3066\u8ffd\u8de1\u3059\u308b\uff0e"
    ]
  },
  "gameplay": {
    "genre": "clicker",
    "expected_duration_minutes": 3,
    "states": ["intro", "playing", "clear", "game_over"],
    "input_actions": ["\u30ed\u30dc\u30c3\u30c8\u3092\u30af\u30ea\u30c3\u30af\u3059\u308b"],
    "clear_condition": "repair_done\u304cmax_repair\u4ee5\u4e0a\u306b\u306a\u308b\uff0e",
    "failure_condition": "\u4fee\u7406\u5b8c\u4e86\u524d\u306btime_left\u304c0\u4ee5\u4e0b\u306b\u306a\u308b\uff0e",
    "settings": [
      {"name": "max_repair", "default": 30, "unit": "\u56de", "meaning": "\u4fee\u7406\u5b8c\u4e86\u307e\u3067\u306e\u57fa\u6e96\u91cf"},
      {"name": "repair_per_click", "default": 1, "unit": "\u56de", "meaning": "1\u30af\u30ea\u30c3\u30af\u306e\u4fee\u7406\u91cf"},
      {"name": "time_limit", "default": 60, "unit": "\u79d2", "meaning": "\u30b2\u30fc\u30e0\u5168\u4f53\u306e\u5236\u9650\u6642\u9593"}
    ]
  },
  "versions": {
    "complete": {
      "version": "1.0.0",
      "status": "needs_qa",
      "source_path": "games/robot-repair-clicker"
    },
    "defect_manifests": [
      "catalog/defects/00_01-D01.json"
    ]
  },
  "tests": [
    {
      "test_id": "00_01-C01",
      "kind": "normal",
      "scenario": "\u30ed\u30dc\u30c3\u30c8\u30928\u56de\u30af\u30ea\u30c3\u30af\u3059\u308b\uff0e",
      "expected": "\u4fee\u7406\u7387\u304c26%\u306b\u306a\u308a\uff0c25%\u6bb5\u968e\u306e\u30b3\u30b9\u30c1\u30e5\u30fc\u30e0\u306b\u5909\u308f\u308b\uff0e"
    },
    {
      "test_id": "00_01-C02",
      "kind": "state-transition",
      "scenario": "\u30ed\u30dc\u30c3\u30c8\u309230\u56de\u30af\u30ea\u30c3\u30af\u3059\u308b\uff0e",
      "expected": "repair_done\u304c30\uff0crepair_percent\u304c100\u3068\u306a\u308a\uff0cgame_state\u304cclear\u306b\u306a\u308b\uff0e"
    },
    {
      "test_id": "00_01-C03",
      "kind": "boundary",
      "scenario": "\u4fee\u7406\u7387\u304c24%\u304b\u308925%\u4ee5\u4e0a\u3078\u5909\u308f\u308b\u5883\u754c\u3092\u901a\u904e\u3059\u308b\uff0e",
      "expected": "\u6570\u5024\u66f4\u65b0\u3068\u540c\u3058\u64cd\u4f5c\u5f8c\u306brobot_25\u3078\u5909\u308f\u308b\uff0e"
    }
  ]
}
